{
  "$schema":"./sample.schema.json",
  "name":"SchemaDeriverName",
  "numberProp" : 18.5,
  "NumberArray": [1,2,3,4],
  "ObjectArray":[
    {
      "ObjectId":"7B3",
      "InnerObjectArray":[
        {
          "name":"TestName",
          "property1" : "18.5"
          
        }
      ],
      "InnerStringArray":["1","2","3"]
    },
    {
      "ObjectId":"7B3"
    }
  ]
}